name,mana_cost,cmc,type_line,oracle_text,colors,color_identity,rarity,set,set_name,collector_number,power,toughness,loyalty,produced_mana,keywords,tags,legal_formats
Kapow!,{2}{G},3.0,Sorcery,Put a +1/+1 counter on target creature you control. It fights target creature an opponent controls. (Each deals damage equal to its power to the other.),G,G,common,OM1,Through the Omenpaths,111,,,,,Fight,pump,"standard,future,historic,timeless,gladiator,pioneer,modern,legacy,pauper,vintage,penny,commander,oathbreaker,standardbrawl,brawl,alchemy,paupercommander,duel"
Karai's Technique,{1}{W}{B},3.0,Sorcery,"Sneak {W}{B} (You may cast this spell for {W}{B} if you also return an unblocked attacker you control to hand during the declare blockers step.)
Choose one or both —
• Target creature gets +3/+3 until end of turn.
• Target creature gets -3/-3 until end of turn.","B,W","B,W",uncommon,TMT,Teenage Mutant Ninja Turtles,152,,,,,Sneak,pump,"standard,future,historic,timeless,gladiator,pioneer,modern,legacy,vintage,penny,commander,oathbreaker,standardbrawl,brawl,alchemy,duel"
Killian's Confidence,{W}{B},2.0,Sorcery,"Target creature gets +1/+1 until end of turn. Draw a card.
Whenever one or more creatures you control deal combat damage to a player, you may pay {W/B}. If you do, return this card from your graveyard to your hand.","B,W","B,W",uncommon,SOS,Secrets of Strixhaven,197,,,,,,draw;pump,"standard,historic,timeless,gladiator,pioneer,modern,legacy,vintage,commander,oathbreaker,standardbrawl,brawl,alchemy,duel"
Kindle the Inner Flame,{3}{R},4.0,Kindred Sorcery — Elemental,"Create a token that's a copy of target creature you control, except it has haste and ""At the beginning of the end step, sacrifice this token.""
Flashback—{1}{R}, Behold three Elementals. (You may cast this card from your graveyard for its flashback cost. Then exile it. To behold an Elemental, choose an Elemental you control or reveal an Elemental card from your hand.)",R,R,uncommon,ECL,Lorwyn Eclipsed,147,,,,,Behold;Flashback,flash;token,"standard,future,historic,timeless,gladiator,pioneer,modern,legacy,vintage,penny,commander,oathbreaker,standardbrawl,brawl,alchemy,duel"
Knockout Maneuver,{2}{G},3.0,Sorcery,"Put a +1/+1 counter on target creature you control, then it deals damage equal to its power to target creature an opponent controls.",G,G,uncommon,SOA,Secrets of Strixhaven Mystical Archive,54,,,,,,pump,"standard,future,historic,timeless,gladiator,pioneer,modern,legacy,vintage,commander,oathbreaker,standardbrawl,brawl,alchemy,duel"
