name,mana_cost,cmc,type_line,oracle_text,colors,color_identity,rarity,set,set_name,collector_number,power,toughness,loyalty,produced_mana,keywords,tags,legal_formats
Splitskin Doll,{1}{W},2.0,Artifact Creature — Toy,"When this creature enters, draw a card. Then discard a card unless you control another creature with power 2 or less.",W,W,uncommon,DSK,Duskmourn: House of Horror,33,2,1,,,,draw;tribal,"standard,future,historic,timeless,gladiator,pioneer,modern,legacy,vintage,commander,oathbreaker,standardbrawl,brawl,alchemy,duel"
Spring Splasher,{1}{U},2.0,Creature — Frog Beast,"Whenever this creature attacks, target creature defending player controls gets -3/-0 until end of turn.",U,U,common,OTJ,Outlaws of Thunder Junction,69,2,1,,,,,"standard,future,historic,timeless,gladiator,pioneer,modern,legacy,pauper,vintage,penny,commander,oathbreaker,standardbrawl,brawl,paupercommander,duel"
Springbloom Druid,{2}{G},3.0,Creature — Elf Druid,"When this creature enters, you may sacrifice a land. If you do, search your library for up to two basic land cards, put them onto the battlefield tapped, then shuffle.",G,G,common,J21,Jumpstart: Historic Horizons,642,1,1,,,,,"standard,future,historic,timeless,gladiator,pioneer,modern,legacy,pauper,vintage,commander,oathbreaker,standardbrawl,brawl,alchemy,paupercommander,duel"
Spyglass Siren,{U},1.0,Creature — Siren Pirate,"Flying
When this creature enters, create a Map token. (It's an artifact with ""{1}, {T}, Sacrifice this token: Target creature you control explores. Activate only as a sorcery."")",U,U,uncommon,LCI,The Lost Caverns of Ixalan,405,1,1,,,Flying;Explore,flying;token,"standard,future,historic,timeless,gladiator,pioneer,modern,legacy,vintage,commander,oathbreaker,standardbrawl,brawl,duel"
Squad Rallier,{3}{W},4.0,Creature — Human Scout,{2}{W}: Look at the top four cards of your library. You may reveal a creature card with power 2 or less from among them and put it into your hand. Put the rest on the bottom of your library in a random order.,W,W,common,FDN,Foundations,24,3,4,,,,,"standard,future,historic,timeless,gladiator,pioneer,modern,legacy,pauper,vintage,commander,oathbreaker,standardbrawl,brawl,alchemy,paupercommander,duel"
"Squall, SeeD Mercenary",{2}{W}{B},4.0,Legendary Creature — Human Knight Mercenary,"Rough Divide — Whenever a creature you control attacks alone, it gains double strike until end of turn.
Whenever Squall deals combat damage to a player, return target permanent card with mana value 3 or less from your graveyard to the battlefield.","B,W","B,W",rare,PSS5,FIN Standard Showdown,2,3,4,,,Rough Divide,bounce,"standard,future,historic,timeless,gladiator,pioneer,modern,legacy,vintage,penny,commander,oathbreaker,standardbrawl,brawl,alchemy,duel"
Squawkroaster,{3}{R},4.0,Creature — Elemental,"Double strike
Vivid — Squawkroaster's power is equal to the number of colors among permanents you control.",R,R,uncommon,ECL,Lorwyn Eclipsed,160,*,4,,,Double strike;Vivid,,"standard,future,historic,timeless,gladiator,pioneer,modern,legacy,vintage,penny,commander,oathbreaker,standardbrawl,brawl,alchemy,duel"
Squirrelanoids,{B},1.0,Creature — Squirrel Mutant,Deathtouch,B,B,common,TMT,Teenage Mutant Ninja Turtles,81,1,1,,,Deathtouch,deathtouch,"standard,future,historic,timeless,gladiator,pioneer,modern,legacy,pauper,vintage,penny,commander,oathbreaker,standardbrawl,brawl,alchemy,paupercommander,duel"
Stadium Headliner,{R},1.0,Creature — Goblin Warrior,"Mobilize 1 (Whenever this creature attacks, create a tapped and attacking 1/1 red Warrior creature token. Sacrifice it at the beginning of the next end step.)
{1}{R}, Sacrifice this creature: It deals damage equal to the number of creatures you control to target creature.",R,R,rare,PTDM,Tarkir: Dragonstorm Promos,122s,1,1,,,Mobilize,token,"standard,future,historic,timeless,gladiator,pioneer,modern,legacy,vintage,penny,commander,oathbreaker,standardbrawl,brawl,alchemy,duel"
Stadium Tidalmage,{2}{U}{R},4.0,Creature — Djinn Sorcerer,"Whenever this creature enters or attacks, you may draw a card. If you do, discard a card.","R,U","R,U",common,SOS,Secrets of Strixhaven,232,4,4,,,,draw,"standard,historic,timeless,gladiator,pioneer,modern,legacy,pauper,vintage,commander,oathbreaker,standardbrawl,brawl,alchemy,duel"
Stagecoach Security,{4}{W},5.0,Creature — Human Soldier,"When this creature enters, creatures you control get +1/+1 and gain vigilance until end of turn.
Plot {3}{W} (You may pay {3}{W} and exile this card from your hand. Cast it as a sorcery on a later turn without paying its mana cost. Plot only as a sorcery.)",W,W,common,OTJ,Outlaws of Thunder Junction,30,4,5,,,Plot,tribal,"standard,future,historic,timeless,gladiator,pioneer,modern,legacy,pauper,vintage,penny,commander,oathbreaker,standardbrawl,brawl,paupercommander,duel"
