name,mana_cost,cmc,type_line,oracle_text,colors,color_identity,rarity,set,set_name,collector_number,power,toughness,loyalty,produced_mana,keywords,tags,legal_formats
"Winter, Cursed Rider",{U}{B},2.0,Legendary Creature — Human Warlock,"Ward—Pay 2 life.
Artifacts you control have ""Ward—Pay 2 life.""
Exhaust — {2}{U}{B}, {T}, Exile X artifact cards from your graveyard: Each other nonartifact creature gets -X/-X until end of turn. (Activate each exhaust ability only once.)","B,U","B,U",rare,DFT,Aetherdrift,228,3,2,,,Exhaust;Ward,tribal,"standard,future,historic,timeless,gladiator,pioneer,modern,legacy,vintage,penny,commander,oathbreaker,standardbrawl,brawl,alchemy,duel"
"Winter, Misanthropic Guide",{1}{B}{R}{G},4.0,Legendary Creature — Human Warlock,"Ward {2}
At the beginning of your upkeep, each player draws two cards.
Delirium — As long as there are four or more card types among cards in your graveyard, each opponent's maximum hand size is equal to seven minus the number of those card types.","B,G,R","B,G,R",rare,PDSK,Duskmourn: House of Horror Promos,240p,3,4,,,Delirium;Ward,protection,"standard,future,historic,timeless,gladiator,pioneer,modern,legacy,vintage,penny,commander,oathbreaker,standardbrawl,brawl,alchemy,duel"
Wispdrinker Vampire,{2}{W}{B},4.0,Creature — Vampire Rogue,"Flying
Whenever another creature you control with power 2 or less enters, each opponent loses 1 life and you gain 1 life.
{5}{W}{B}: Creatures you control with power 2 or less gain deathtouch and lifelink until end of turn.","B,W","B,W",uncommon,MKM,Murders at Karlov Manor,374,2,4,,,Flying,flying;lifegain;tribal,"standard,future,historic,timeless,gladiator,pioneer,modern,legacy,vintage,commander,oathbreaker,standardbrawl,brawl,duel"
Wistfulness,{3}{G/U}{G/U},5.0,Creature — Elemental Incarnation,"When this creature enters, if {G}{G} was spent to cast it, exile target artifact or enchantment an opponent controls.
When this creature enters, if {U}{U} was spent to cast it, draw two cards, then discard a card.
Evoke {G/U}{G/U} (You may cast this spell for its evoke cost. If you do, it's sacrificed when it enters.)","G,U","G,U",mythic,ECL,Lorwyn Eclipsed,296,6,5,,,Evoke,draw;etb;removal,"standard,future,historic,timeless,gladiator,pioneer,modern,legacy,vintage,commander,oathbreaker,standardbrawl,brawl,alchemy,duel"
"Witherbloom, the Balancer",{6}{B}{G},8.0,Legendary Creature — Elder Dragon,"Affinity for creatures (This spell costs {1} less to cast for each creature you control.)
Flying, deathtouch
Instant and sorcery spells you cast have affinity for creatures.","B,G","B,G",mythic,SOS,Secrets of Strixhaven,288,5,5,,,Deathtouch;Flying;Affinity,deathtouch;flying,"standard,historic,timeless,gladiator,pioneer,modern,legacy,vintage,commander,oathbreaker,standardbrawl,brawl,alchemy,duel"
Wojek Investigator,{2}{W},3.0,Creature — Angel Detective,"Flying, vigilance
At the beginning of your upkeep, investigate once for each opponent who has more cards in hand than you. (To investigate, create a Clue token. It's an artifact with ""{2}, Sacrifice this token: Draw a card."")",W,W,rare,PMKM,Murders at Karlov Manor Promos,36p,2,4,,,Flying;Investigate;Vigilance,draw;flying;token;vigilance,"standard,future,historic,timeless,gladiator,pioneer,modern,legacy,vintage,penny,commander,oathbreaker,standardbrawl,brawl,duel"
Wolfbat,{2}{B},3.0,Creature — Wolf Bat,"Flying
Whenever you draw your second card each turn, you may pay {B}. If you do, return this card from your graveyard to the battlefield with a finality counter on it. (If a creature with a finality counter on it would die, exile it instead.)",B,B,uncommon,TLA,Avatar: The Last Airbender,122,2,2,,,Flying,flying,"standard,future,historic,timeless,gladiator,pioneer,modern,legacy,vintage,penny,commander,oathbreaker,standardbrawl,brawl,alchemy,duel"
Woodland Acolyte // Mend the Wilds,{2}{W} // {G},3.0,Creature — Human Cleric // Instant — Adventure,,W,"G,W",uncommon,WOE,Wilds of Eldraine,241,2,2,,,,,"standard,future,historic,timeless,gladiator,pioneer,modern,legacy,vintage,commander,oathbreaker,standardbrawl,brawl,duel"
"Wraith, Vicious Vigilante",{1}{W}{U},3.0,Legendary Creature — Human Detective Hero,"Double strike
Fear Gas — Wraith can't be blocked.","U,W","U,W",uncommon,OM1,Through the Omenpaths,146,1,1,,,Fear;Double strike,,"standard,future,historic,timeless,gladiator,pioneer,modern,legacy,vintage,commander,oathbreaker,standardbrawl,brawl,alchemy,duel"
Wrangler of the Damned,{3}{W}{U},5.0,Creature — Human Soldier,"Flash
At the beginning of your end step, if you haven't cast a spell from your hand this turn, create a 2/2 white Spirit creature token with flying.","U,W","U,W",uncommon,OTJ,Outlaws of Thunder Junction,238,1,4,,,Flash,flash;token,"standard,future,historic,timeless,gladiator,pioneer,modern,legacy,vintage,commander,oathbreaker,standardbrawl,brawl,duel"
Wreck Remover,{4},4.0,Artifact Creature — Construct,"Whenever this creature enters or attacks, exile up to one target card from a graveyard. You gain 1 life.
Cycling {2} ({2}, Discard this card: Draw a card.)",,,common,DFT,Aetherdrift,247,3,4,,,Cycling,draw;lifegain,"standard,future,historic,timeless,gladiator,pioneer,modern,legacy,pauper,vintage,penny,commander,oathbreaker,standardbrawl,brawl,alchemy,paupercommander,duel"
Wreckage Wickerfolk,{1}{B},2.0,Artifact Creature — Scarecrow,"Flying
When this creature enters, surveil 2. (Look at the top two cards of your library, then put any number of them into your graveyard and the rest on top of your library in any order.)",B,B,common,DFT,Aetherdrift,110,1,3,,,Flying;Surveil,flying;surveil,"standard,future,historic,timeless,gladiator,pioneer,modern,legacy,pauper,vintage,commander,oathbreaker,standardbrawl,brawl,alchemy,paupercommander,duel"
Wretched Doll,{1}{B},2.0,Artifact Creature — Toy,"{B}, {T}: Surveil 1. (Look at the top card of your library. You may put that card into your graveyard.)",B,B,uncommon,DFT,Aetherdrift,111,3,1,,,Surveil,surveil,"standard,future,historic,timeless,gladiator,pioneer,modern,legacy,vintage,commander,oathbreaker,standardbrawl,brawl,alchemy,duel"
"Wylie Duke, Atiin Hero",{1}{G}{W},3.0,Legendary Creature — Human Ranger,"Vigilance
Whenever Wylie Duke becomes tapped, you gain 1 life and draw a card.","G,W","G,W",rare,OTJ,Outlaws of Thunder Junction,367,4,2,,,Vigilance,draw;lifegain;vigilance,"standard,future,historic,timeless,gladiator,pioneer,modern,legacy,vintage,penny,commander,oathbreaker,standardbrawl,brawl,duel"
